    1 0.000000000 IP A → IP B TCP 66 8864 → 22 [ACK] Seq=1 Ack=1 Win=2047 Len=0 TSval=1271329521 TSecr=2646370143
    2 0.010267152 06:1f:58:9e:a7:34 → 06:0b:6a:3a:90:9a ARP 56 Who has IP B? Tell 172.31.32.1
    3 0.010279941 06:0b:6a:3a:90:9a → 06:1f:58:9e:a7:34 ARP 42 IP B is at 06:0b:6a:3a:90:9a
    4 0.438433825 IP B → IP A SSH 110 Server: Encrypted packet (len=44)
    5 0.609365486 IP A → IP B TCP 66 8864 → 22 [ACK] Seq=1 Ack=45 Win=2047 Len=0 TSval=1271330125 TSecr=2646370652
    6 0.950515954 IP B → IP A SSH 110 Server: Encrypted packet (len=44)
    7 1.120039749 IP A → IP B TCP 66 8864 → 22 [ACK] Seq=1 Ack=89 Win=2047 Len=0 TSval=1271330635 TSecr=2646371164
    8 1.462570232 IP B → IP A SSH 110 Server: Encrypted packet (len=44)
    9 1.587607691 IP C → IP B TCP 66 48018 → 443 [ACK] Seq=1 Ack=1 Win=46 Len=0 TSval=3709220925 TSecr=1632657360
   10 1.587646662 IP B → IP C TCP 66 [TCP ACKed unseen segment] 443 → 48018 [ACK] Seq=1 Ack=2 Win=221 Len=0 TSval=1632672468 TSecr=3709115062
   11 1.630529631 IP A → IP B TCP 66 8864 → 22 [ACK] Seq=1 Ack=133 Win=2047 Len=0 TSval=1271331145 TSecr=2646371676
   12 1.974437693 IP B → IP A SSH 110 Server: Encrypted packet (len=44)
   13 2.144240495 IP A → IP B TCP 66 8864 → 22 [ACK] Seq=1 Ack=177 Win=2047 Len=0 TSval=1271331657 TSecr=2646372188
   14 2.486529706 IP B → IP A SSH 110 Server: Encrypted packet (len=44)
   15 2.654396194 IP A → IP B TCP 66 8864 → 22 [ACK] Seq=1 Ack=221 Win=2047 Len=0 TSval=1271332168 TSecr=2646372700
   16 2.998594998 IP B → IP A SSH 110 Server: Encrypted packet (len=44)
   17 3.166174961 IP A → IP B TCP 66 8864 → 22 [ACK] Seq=1 Ack=265 Win=2047 Len=0 TSval=1271332675 TSecr=2646373212
   18 3.510390884 IP B → IP A SSH 110 Server: Encrypted packet (len=44)
   19 3.678979722 IP A → IP B TCP 66 8864 → 22 [ACK] Seq=1 Ack=309 Win=2047 Len=0 TSval=1271333186 TSecr=2646373724
   20 4.022549049 IP B → IP A SSH 110 Server: Encrypted packet (len=44)
   21 4.192166549 IP A → IP B TCP 66 8864 → 22 [ACK] Seq=1 Ack=353 Win=2047 Len=0 TSval=1271333695 TSecr=2646374236
   22 4.534567162 IP B → IP A SSH 110 Server: Encrypted packet (len=44)
   23 4.701631213 IP A → IP B TCP 66 8864 → 22 [ACK] Seq=1 Ack=397 Win=2047 Len=0 TSval=1271334205 TSecr=2646374748
   24 4.855968870 IP A → IP B TLSv1.2 123 Application Data
   25 4.856009818 IP A → IP B TLSv1.2 105 Application Data
   26 4.856064762 IP B → IP A TCP 66 443 → 6138 [ACK] Seq=1 Ack=97 Win=221 Len=0 TSval=2646375070 TSecr=932507122
   27 4.857310235 IP B → IP A TCP 2922 [TCP segment of a reassembled PDU]
   28 4.857319718 IP B → IP A TCP 2922 443 → 6138 [PSH, ACK] Seq=2857 Ack=97 Win=221 Len=2856 TSval=2646375071 TSecr=932507122 [TCP segment of a reassembled PDU]
   29 4.857376491 IP B → IP A TCP 2922 443 → 6138 [PSH, ACK] Seq=5713 Ack=97 Win=221 Len=2856 TSval=2646375071 TSecr=932507122 [TCP segment of a reassembled PDU]
   30 4.857409894 IP B → IP A TCP 2922 443 → 6138 [PSH, ACK] Seq=8569 Ack=97 Win=221 Len=2856 TSval=2646375071 TSecr=932507122 [TCP segment of a reassembled PDU]
   31 4.857443737 IP B → IP A TCP 2922 443 → 6138 [PSH, ACK] Seq=11425 Ack=97 Win=221 Len=2856 TSval=2646375071 TSecr=932507122 [TCP segment of a reassembled PDU]
   32 4.896580641 IP A → IP B TCP 66 6138 → 443 [ACK] Seq=97 Ack=2857 Win=2003 Len=0 TSval=932507164 TSecr=2646375071
   33 4.896620066 IP B → IP A TLSv1.2 2922 Application Data [TCP segment of a reassembled PDU]
   34 4.896637689 IP A → IP B TCP 66 6138 → 443 [ACK] Seq=97 Ack=5713 Win=1958 Len=0 TSval=932507164 TSecr=2646375071
   35 4.896650852 IP A → IP B TCP 66 6138 → 443 [ACK] Seq=97 Ack=8569 Win=1914 Len=0 TSval=932507164 TSecr=2646375071
   36 4.896678114 IP B → IP A TLSv1.2 742 Application Data, Application Data
   37 4.897141916 IP A → IP B TCP 66 6138 → 443 [ACK] Seq=97 Ack=11425 Win=1869 Len=0 TSval=932507164 TSecr=2646375071
   38 4.897148505 IP A → IP B TCP 66 6138 → 443 [ACK] Seq=97 Ack=12853 Win=2048 Len=0 TSval=932507164 TSecr=2646375071
   39 4.898829481 IP A → IP B TCP 66 6138 → 443 [ACK] Seq=97 Ack=14281 Win=2025 Len=0 TSval=932507166 TSecr=2646375071
   40 4.937874017 IP A → IP B TCP 66 6138 → 443 [ACK] Seq=97 Ack=17137 Win=2003 Len=0 TSval=932507201 TSecr=2646375110
   41 4.937901288 IP A → IP B TCP 66 6138 → 443 [ACK] Seq=97 Ack=17813 Win=1992 Len=0 TSval=932507201 TSecr=2646375110
   42 4.937920694 IP A → IP B TCP 66 [TCP Window Update] 6138 → 443 [ACK] Seq=97 Ack=17813 Win=2048 Len=0 TSval=932507201 TSecr=2646375110
   43 5.046427644 IP B → IP A SSH 110 Server: Encrypted packet (len=44)
   44 5.222088135 IP A → IP B TCP 66 8864 → 22 [ACK] Seq=1 Ack=441 Win=2047 Len=0 TSval=1271334724 TSecr=2646375260
   45 5.558501012 IP B → IP A SSH 110 Server: Encrypted packet (len=44)
   46 5.726162516 IP A → IP B TCP 66 8864 → 22 [ACK] Seq=1 Ack=485 Win=2047 Len=0 TSval=1271335225 TSecr=2646375772
   47 5.940741148 IP A → IP B TLSv1.2 157 Application Data
   48 5.940787220 IP A → IP B TLSv1.2 308 Application Data
   49 5.940841423 IP B → IP A TCP 66 443 → 6138 [ACK] Seq=17813 Ack=430 Win=221 Len=0 TSval=2646376154 TSecr=932508201
   50 5.941081031 IP B → IP A TLSv1.2 101 Application Data
   51 5.942071496 IP B → IP A TLSv1.2 758 Application Data
   52 5.980296353 IP A → IP B TCP 66 6138 → 443 [ACK] Seq=430 Ack=17848 Win=2047 Len=0 TSval=932508241 TSecr=2646376155
   53 5.981101929 IP A → IP B TCP 66 6138 → 443 [ACK] Seq=430 Ack=18540 Win=2037 Len=0 TSval=932508242 TSecr=2646376156
   54 6.070453223 IP B → IP A SSH 110 Server: Encrypted packet (len=44)
   55 6.146339987 IP A → IP B TLSv1.2 136 Application Data
   56 6.146375842 IP A → IP B TLSv1.2 284 Application Data
   57 6.146420458 IP B → IP A TCP 66 443 → 6138 [ACK] Seq=18540 Ack=718 Win=221 Len=0 TSval=2646376360 TSecr=932508400
   58 6.146634516 IP B → IP A TLSv1.2 101 Application Data
   59 6.147524565 IP B → IP A TLSv1.2 405 Application Data
   60 6.197036363 IP A → IP B TCP 66 6138 → 443 [ACK] Seq=718 Ack=18575 Win=2047 Len=0 TSval=932508451 TSecr=2646376360
   61 6.197055942 IP A → IP B TCP 66 6138 → 443 [ACK] Seq=718 Ack=18914 Win=2042 Len=0 TSval=932508451 TSecr=2646376361
   62 6.237934689 IP A → IP B TCP 66 8864 → 22 [ACK] Seq=1 Ack=529 Win=2047 Len=0 TSval=1271335735 TSecr=2646376284
   63 6.311874014 IP A → IP B TLSv1.2 136 Application Data
   64 6.311893428 IP A → IP B TLSv1.2 289 Application Data
   65 6.311939261 IP B → IP A TCP 66 443 → 6138 [ACK] Seq=18914 Ack=1011 Win=221 Len=0 TSval=2646376525 TSecr=932508566
   66 6.312188804 IP B → IP A TLSv1.2 101 Application Data
   67 6.313006073 IP B → IP A TLSv1.2 760 Application Data
   68 6.351436521 IP A → IP B TCP 66 6138 → 443 [ACK] Seq=1011 Ack=18949 Win=2047 Len=0 TSval=932508605 TSecr=2646376526
   69 6.351448487 IP A → IP B TCP 66 6138 → 443 [ACK] Seq=1011 Ack=19643 Win=2037 Len=0 TSval=932508606 TSecr=2646376526
   70 6.529979390 IP A → IP B TLSv1.2 136 Application Data
   71 6.530176633 IP B → IP A TLSv1.2 101 Application Data
   72 6.530278048 IP A → IP B TLSv1.2 322 Application Data
   73 6.531340534 IP B → IP A TLSv1.2 569 Application Data
   74 6.570165423 IP A → IP B TCP 66 6138 → 443 [ACK] Seq=1337 Ack=19678 Win=2047 Len=0 TSval=932508822 TSecr=2646376744
   75 6.570175191 IP A → IP B TCP 66 6138 → 443 [ACK] Seq=1337 Ack=20181 Win=2040 Len=0 TSval=932508823 TSecr=2646376745
   76 6.582458347 IP B → IP A SSH 110 Server: Encrypted packet (len=44)
   77 6.706791698 IP A → IP B TLSv1.2 136 Application Data
   78 6.706960206 IP A → IP B TLSv1.2 331 Application Data
   79 6.706995177 IP B → IP A TCP 66 443 → 6138 [ACK] Seq=20181 Ack=1672 Win=221 Len=0 TSval=2646376920 TSecr=932508958
   80 6.707015991 IP B → IP A TLSv1.2 101 Application Data
   81 6.708002378 IP B → IP A TLSv1.2 509 Application Data
   82 6.747626043 IP A → IP B TCP 66 6138 → 443 [ACK] Seq=1672 Ack=20216 Win=2047 Len=0 TSval=932508997 TSecr=2646376920
   83 6.747639824 IP A → IP B TCP 66 6138 → 443 [ACK] Seq=1672 Ack=20659 Win=2041 Len=0 TSval=932508998 TSecr=2646376921
   84 6.751590265 IP A → IP B TCP 66 8864 → 22 [ACK] Seq=1 Ack=573 Win=2047 Len=0 TSval=1271336246 TSecr=2646376796
   85 6.870275560 IP A → IP B TLSv1.2 136 Application Data
   86 6.870301159 IP A → IP B TLSv1.2 622 Application Data
   87 6.870343885 IP B → IP A TCP 66 443 → 6138 [ACK] Seq=20659 Ack=2298 Win=221 Len=0 TSval=2646377084 TSecr=932509120
   88 6.870594492 IP B → IP A TLSv1.2 101 Application Data
   89 6.871831927 IP B → IP A TCP 2922 [TCP segment of a reassembled PDU]
   90 6.871883509 IP B → IP A TLSv1.2 163 Application Data, Application Data
   91 6.909335036 IP A → IP B TCP 66 6138 → 443 [ACK] Seq=2298 Ack=20694 Win=2047 Len=0 TSval=932509160 TSecr=2646377084
   92 6.910182698 IP A → IP B TCP 66 6138 → 443 [ACK] Seq=2298 Ack=23550 Win=2003 Len=0 TSval=932509161 TSecr=2646377085
   93 6.910205480 IP A → IP B TCP 66 [TCP Window Update] 6138 → 443 [ACK] Seq=2298 Ack=23550 Win=2048 Len=0 TSval=932509161 TSecr=2646377085
   94 6.910733264 IP A → IP B TCP 66 6138 → 443 [ACK] Seq=2298 Ack=23647 Win=2046 Len=0 TSval=932509162 TSecr=2646377085
   95 7.024556974 IP A → IP B TLSv1.2 140 Application Data
   96 7.024730608 IP B → IP A TLSv1.2 101 Application Data
   97 7.025761464 IP A → IP B TLSv1.2 652 Application Data
   98 7.027408549 IP A → IP B TLSv1.2 137 Application Data
   99 7.027436340 IP B → IP A TCP 66 443 → 6138 [ACK] Seq=23682 Ack=3029 Win=221 Len=0 TSval=2646377241 TSecr=932509274
  100 7.027822322 IP B → IP A TCP 2922 [TCP segment of a reassembled PDU]
  101 7.027831509 IP B → IP A TLSv1.2 1485 Application Data
  102 7.042649348 IP B → IP A TLSv1.2 768 Application Data
  103 7.064469588 IP A → IP B TCP 66 6138 → 443 [ACK] Seq=3029 Ack=23682 Win=2047 Len=0 TSval=932509312 TSecr=2646377238
  104 7.066490456 IP A → IP B TCP 66 6138 → 443 [ACK] Seq=3029 Ack=26538 Win=2003 Len=0 TSval=932509315 TSecr=2646377241
  105 7.066714892 IP A → IP B TCP 66 6138 → 443 [ACK] Seq=3029 Ack=27957 Win=1981 Len=0 TSval=932509315 TSecr=2646377241
  106 7.066736310 IP A → IP B TCP 66 [TCP Window Update] 6138 → 443 [ACK] Seq=3029 Ack=27957 Win=2048 Len=0 TSval=932509315 TSecr=2646377241
  107 7.083189099 IP A → IP B TCP 66 6138 → 443 [ACK] Seq=3029 Ack=28659 Win=2037 Len=0 TSval=932509329 TSecr=2646377256
  108 7.094495168 IP B → IP A SSH 110 Server: Encrypted packet (len=44)
  109 7.104269553 IP A → IP B TLSv1.2 140 Application Data
  110 7.104284392 IP A → IP B TLSv1.2 823 Application Data
  111 7.104313209 IP B → IP A TCP 66 443 → 6138 [ACK] Seq=28659 Ack=3860 Win=221 Len=0 TSval=2646377318 TSecr=932509350
  112 7.104529756 IP B → IP A TLSv1.2 101 Application Data
  113 7.105845392 IP B → IP A TLSv1.2 2167 Application Data, Application Data
  114 7.143525960 IP A → IP B TCP 66 6138 → 443 [ACK] Seq=3860 Ack=28694 Win=2047 Len=0 TSval=932509390 TSecr=2646377318
  115 7.143784132 IP A → IP B TCP 66 6138 → 443 [ACK] Seq=3860 Ack=30795 Win=2015 Len=0 TSval=932509391 TSecr=2646377319
  116 7.260646321 IP A → IP B TCP 66 8864 → 22 [ACK] Seq=1 Ack=617 Win=2047 Len=0 TSval=1271336754 TSecr=2646377308
  117 7.606541620 IP B → IP A SSH 110 Server: Encrypted packet (len=44)
  118 7.647639281 IP A → IP B TLSv1.2 140 Application Data
  119 7.647682748 IP A → IP B TLSv1.2 387 [TCP Previous segment not captured] , Ignored Unknown Record
  120 7.647697138 IP B → IP A TCP 78 443 → 6138 [ACK] Seq=30795 Ack=3934 Win=221 Len=0 TSval=2646377861 TSecr=932509885 SLE=5362 SRE=5683
  121 7.647707950 IP A → IP B TCP 1494 [TCP Out-Of-Order] 6138 → 443 [ACK] Seq=3934 Ack=30795 Win=2048 Len=1428 TSval=932509885 TSecr=2646377319
  122 7.647714532 IP B → IP A TCP 66 443 → 6138 [ACK] Seq=30795 Ack=5683 Win=221 Len=0 TSval=2646377861 TSecr=932509885
  123 7.648002564 IP B → IP A TLSv1.2 101 Application Data
  124 7.649667342 IP B → IP A TCP 2922 [TCP segment of a reassembled PDU]
  125 7.649677812 IP B → IP A TLSv1.2 1227 Application Data, Application Data
  126 7.687944916 IP A → IP B TCP 66 6138 → 443 [ACK] Seq=5683 Ack=30830 Win=2047 Len=0 TSval=932509926 TSecr=2646377861
  127 7.688515691 IP A → IP B TCP 66 6138 → 443 [ACK] Seq=5683 Ack=33686 Win=2003 Len=0 TSval=932509928 TSecr=2646377863
  128 7.688910031 IP A → IP B TCP 66 6138 → 443 [ACK] Seq=5683 Ack=34847 Win=1985 Len=0 TSval=932509928 TSecr=2646377863
  129 7.688915796 IP A → IP B TCP 66 [TCP Window Update] 6138 → 443 [ACK] Seq=5683 Ack=34847 Win=2048 Len=0 TSval=932509928 TSecr=2646377863
  130 7.771263951 IP A → IP B TCP 66 8864 → 22 [ACK] Seq=1 Ack=661 Win=2047 Len=0 TSval=1271337263 TSecr=2646377820
  131 7.870052691 IP A → IP B TLSv1.2 136 Application Data
  132 7.870076191 IP A → IP B TLSv1.2 208 Application Data
  133 7.870118727 IP B → IP A TCP 66 443 → 6138 [ACK] Seq=34847 Ack=5895 Win=221 Len=0 TSval=2646378084 TSecr=932510107
  134 7.870358616 IP B → IP A TLSv1.2 101 Application Data
  135 7.871012765 IP B → IP A TLSv1.2 1587 Application Data
  136 7.909284631 IP A → IP B TCP 66 6138 → 443 [ACK] Seq=5895 Ack=34882 Win=2047 Len=0 TSval=932510146 TSecr=2646378084
  137 7.909710508 IP A → IP B TCP 66 6138 → 443 [ACK] Seq=5895 Ack=36403 Win=2024 Len=0 TSval=932510147 TSecr=2646378084
  138 7.978884203 IP A → IP B TLSv1.2 208 [TCP Previous segment not captured] , Application Data
  139 7.978911881 IP B → IP A TCP 78 [TCP Dup ACK 133#1] 443 → 6138 [ACK] Seq=36403 Ack=5895 Win=221 Len=0 TSval=2646378192 TSecr=932510147 SLE=5965 SRE=6107
  140 7.978920464 IP A → IP B TCP 136 [TCP Out-Of-Order] 6138 → 443 [PSH, ACK] Seq=5895 Ack=36403 Win=2048 Len=70 TSval=932510214 TSecr=2646378084
  141 7.978930631 IP B → IP A TCP 66 443 → 6138 [ACK] Seq=36403 Ack=6107 Win=221 Len=0 TSval=2646378192 TSecr=932510214
  142 7.979208047 IP B → IP A TLSv1.2 101 Application Data
  143 8.019901677 IP A → IP B TCP 66 6138 → 443 [ACK] Seq=6107 Ack=36438 Win=2047 Len=0 TSval=932510254 TSecr=2646378193
  144 8.118526813 IP B → IP A SSH 110 Server: Encrypted packet (len=44)
  145 8.287074900 IP A → IP B TCP 66 8864 → 22 [ACK] Seq=1 Ack=705 Win=2047 Len=0 TSval=1271337772 TSecr=2646378332
  146 8.630437572 IP B → IP A SSH 110 Server: Encrypted packet (len=44)
  147 8.796221406 IP A → IP B TCP 66 8864 → 22 [ACK] Seq=1 Ack=749 Win=2047 Len=0 TSval=1271338282 TSecr=2646378844
  148 8.853244610 IP A → IP B TLSv1.2 140 Application Data
  149 8.853271183 IP A → IP B TLSv1.2 779 Application Data
  150 8.853322115 IP B → IP A TCP 66 443 → 6138 [ACK] Seq=36438 Ack=6894 Win=221 Len=0 TSval=2646379067 TSecr=932511084
  151 8.853549825 IP B → IP A TLSv1.2 101 Application Data
  152 8.854671846 IP B → IP A TLSv1.2 1224 Application Data
  153 8.892642227 IP A → IP B TCP 66 6138 → 443 [ACK] Seq=6894 Ack=36473 Win=2047 Len=0 TSval=932511124 TSecr=2646379067
  154 8.892666505 IP A → IP B TCP 66 6138 → 443 [ACK] Seq=6894 Ack=37631 Win=2029 Len=0 TSval=932511125 TSecr=2646379068
  155 9.142555593 IP B → IP A SSH 110 Server: Encrypted packet (len=44)
  156 9.214671650 IP A → IP B TCP 66 8864 → 22 [ACK] Seq=1 Ack=793 Win=2047 Len=0 TSval=1271338698 TSecr=2646379356
  157 9.654162099 IP B → IP A SSH 110 Server: Encrypted packet (len=44)
  158 9.726607541 IP A → IP B TCP 66 8864 → 22 [ACK] Seq=1 Ack=837 Win=2047 Len=0 TSval=1271339208 TSecr=2646379868
  159 10.083964062 IP A → IP B TLSv1.2 140 Application Data
  160 10.084006675 IP A → IP B TLSv1.2 778 Application Data
  161 10.084056962 IP B → IP A TCP 66 443 → 6138 [ACK] Seq=37631 Ack=7680 Win=221 Len=0 TSval=2646380298 TSecr=932512311
  162 10.084308883 IP B → IP A TLSv1.2 101 Application Data
  163 10.085526699 IP B → IP A TLSv1.2 1223 Application Data
  164 10.125292295 IP A → IP B TCP 66 6138 → 443 [ACK] Seq=7680 Ack=38823 Win=2029 Len=0 TSval=932512350 TSecr=2646380299
  165 10.125305220 IP A → IP B TCP 66 6138 → 443 [ACK] Seq=7680 Ack=37666 Win=2047 Len=0 TSval=932512349 TSecr=2646380298
  166 10.166465334 IP B → IP A SSH 110 Server: Encrypted packet (len=44)
  167 10.240137167 IP A → IP B TCP 66 8864 → 22 [ACK] Seq=1 Ack=881 Win=2047 Len=0 TSval=1271339717 TSecr=2646380380
  168 10.678488555 IP B → IP A SSH 110 Server: Encrypted packet (len=44)
  169 10.750102224 IP A → IP B TCP 66 8864 → 22 [ACK] Seq=1 Ack=925 Win=2047 Len=0 TSval=1271340226 TSecr=2646380892
  170 11.190551261 IP B → IP A SSH 110 Server: Encrypted packet (len=44)
  171 11.262543789 IP A → IP B TCP 66 8864 → 22 [ACK] Seq=1 Ack=969 Win=2047 Len=0 TSval=1271340735 TSecr=2646381404
  172 11.702541685 IP B → IP A SSH 110 Server: Encrypted packet (len=44)
  173 11.774336330 IP A → IP B TCP 66 8864 → 22 [ACK] Seq=1 Ack=1013 Win=2047 Len=0 TSval=1271341245 TSecr=2646381916
  174 12.214429778 IP B → IP A SSH 110 Server: Encrypted packet (len=44)
  175 12.286901499 IP A → IP B TCP 66 8864 → 22 [ACK] Seq=1 Ack=1057 Win=2047 Len=0 TSval=1271341756 TSecr=2646382428
  176 12.726432745 IP B → IP A SSH 110 Server: Encrypted packet (len=44)
  177 12.798685228 IP A → IP B TCP 66 8864 → 22 [ACK] Seq=1 Ack=1101 Win=2047 Len=0 TSval=1271342266 TSecr=2646382940
  178 12.864200370 IP C → IP B TLSv1.2 162 [TCP Previous segment not captured] , Application Data, Application Data
  179 12.865494023 IP B → IP C TCP 7306 [TCP ACKed unseen segment]  [TCP segment of a reassembled PDU]
  180 12.865506297 IP B → IP C TCP 7306 443 → 48018 [PSH, ACK] Seq=7241 Ack=98 Win=221 Len=7240 TSval=1632683746 TSecr=3709232201 [TCP segment of a reassembled PDU]
  181 12.867174253 IP C → IP B TCP 66 48018 → 443 [ACK] Seq=98 Ack=7241 Win=45 Len=0 TSval=3709232204 TSecr=1632683746
  182 12.867195825 IP B → IP C TLSv1.2 3398 Application Data, Application Data, Application Data
  183 12.867210642 IP C → IP B TCP 66 48018 → 443 [ACK] Seq=98 Ack=13033 Win=44 Len=0 TSval=3709232204 TSecr=1632683746
  184 12.867216255 IP C → IP B TCP 66 48018 → 443 [ACK] Seq=98 Ack=14481 Win=44 Len=0 TSval=3709232204 TSecr=1632683746
  185 12.868730322 IP C → IP B TCP 66 48018 → 443 [ACK] Seq=98 Ack=17813 Win=45 Len=0 TSval=3709232206 TSecr=1632683748
  186 13.238535338 IP B → IP A SSH 110 Server: Encrypted packet (len=44)
  187 13.312167943 IP A → IP B TCP 66 8864 → 22 [ACK] Seq=1 Ack=1145 Win=2047 Len=0 TSval=1271342773 TSecr=2646383452
  188 13.380904190 IP C → IP B TLSv1.2 399 Application Data, Application Data
  189 13.381205020 IP B → IP C TLSv1.2 101 Application Data
  190 13.382213165 IP B → IP C TLSv1.2 758 Application Data
  191 13.382677090 IP C → IP B TCP 66 48018 → 443 [ACK] Seq=431 Ack=17848 Win=46 Len=0 TSval=3709232720 TSecr=1632684262
  192 13.383698772 IP C → IP B TCP 66 48018 → 443 [ACK] Seq=431 Ack=18540 Win=46 Len=0 TSval=3709232721 TSecr=1632684263
  193 13.534232771 IP C → IP B TLSv1.2 354 Application Data, Application Data
  194 13.534532904 IP B → IP C TLSv1.2 101 Application Data
  195 13.535551930 IP B → IP C TLSv1.2 405 Application Data
  196 13.535992943 IP C → IP B TCP 66 48018 → 443 [ACK] Seq=719 Ack=18575 Win=46 Len=0 TSval=3709232873 TSecr=1632684415
  197 13.537023342 IP C → IP B TCP 66 48018 → 443 [ACK] Seq=719 Ack=18914 Win=46 Len=0 TSval=3709232874 TSecr=1632684416
  198 13.688547418 IP C → IP B TLSv1.2 359 Application Data, Application Data
  199 13.688870422 IP B → IP C TLSv1.2 101 Application Data
  200 13.689787380 IP B → IP C TLSv1.2 760 Application Data
  201 13.690420789 IP C → IP B TCP 66 48018 → 443 [ACK] Seq=1012 Ack=18949 Win=46 Len=0 TSval=3709233028 TSecr=1632684569
  202 13.691290619 IP C → IP B TCP 66 48018 → 443 [ACK] Seq=1012 Ack=19643 Win=46 Len=0 TSval=3709233028 TSecr=1632684570
  203 13.750461401 IP B → IP A SSH 110 Server: Encrypted packet (len=44)
  204 13.824134092 IP A → IP B TCP 66 8864 → 22 [ACK] Seq=1 Ack=1189 Win=2047 Len=0 TSval=1271343275 TSecr=2646383964
  205 13.841852839 IP C → IP B TLSv1.2 392 Application Data, Application Data
  206 13.842251698 IP B → IP C TLSv1.2 101 Application Data
  207 13.843098558 IP B → IP C TLSv1.2 569 Application Data
  208 13.843776979 IP C → IP B TCP 66 48018 → 443 [ACK] Seq=1338 Ack=19678 Win=46 Len=0 TSval=3709233181 TSecr=1632684723
  209 13.844566787 IP C → IP B TCP 66 48018 → 443 [ACK] Seq=1338 Ack=20181 Win=46 Len=0 TSval=3709233182 TSecr=1632684724
  210 13.994726849 IP C → IP B TLSv1.2 401 Application Data, Application Data
  211 13.995013768 IP B → IP C TLSv1.2 101 Application Data
  212 13.995849099 IP B → IP C TLSv1.2 509 Application Data
  213 13.996500202 IP C → IP B TCP 66 48018 → 443 [ACK] Seq=1673 Ack=20216 Win=46 Len=0 TSval=3709233334 TSecr=1632684875
  214 13.997342628 IP C → IP B TCP 66 48018 → 443 [ACK] Seq=1673 Ack=20659 Win=46 Len=0 TSval=3709233335 TSecr=1632684876
  215 14.137240630 IP C → IP B TLSv1.2 1134 Application Data, Application Data
  216 14.137280141 IP C → IP B TLSv1.2 137 Application Data
  217 14.137339862 IP B → IP C TCP 66 443 → 48018 [ACK] Seq=20659 Ack=2812 Win=221 Len=0 TSval=1632685018 TSecr=3709233474
  218 14.138066604 IP B → IP C TLSv1.2 4376 Application Data, Application Data
  219 14.139486723 IP B → IP C TLSv1.2 3019 Application Data, Application Data
  220 14.139637125 IP C → IP B TCP 66 48018 → 443 [ACK] Seq=2812 Ack=24969 Win=46 Len=0 TSval=3709233477 TSecr=1632685019
  221 14.141045651 IP C → IP B TCP 66 48018 → 443 [ACK] Seq=2812 Ack=27922 Win=46 Len=0 TSval=3709233478 TSecr=1632685020
  222 14.187128170 IP C → IP B TLSv1.2 140 Application Data
  223 14.187727558 IP B → IP C TLSv1.2 6791 Application Data
  224 14.189305727 IP C → IP B TCP 66 48018 → 443 [ACK] Seq=2886 Ack=34647 Win=46 Len=0 TSval=3709233526 TSecr=1632685068
  225 14.262535261 IP B → IP A SSH 110 Server: Encrypted packet (len=44)
  226 14.278648419 IP C → IP B TLSv1.2 278 Application Data, Application Data
  227 14.278915642 IP B → IP C TLSv1.2 101 Application Data
  228 14.279696963 IP B → IP C TLSv1.2 768 Application Data
  229 14.280441811 IP C → IP B TCP 66 48018 → 443 [ACK] Seq=3098 Ack=34682 Win=46 Len=0 TSval=3709233618 TSecr=1632685159
  230 14.281201623 IP C → IP B TCP 66 48018 → 443 [ACK] Seq=3098 Ack=35384 Win=46 Len=0 TSval=3709233618 TSecr=1632685160
  231 14.334703354 IP A → IP B TCP 66 8864 → 22 [ACK] Seq=1 Ack=1233 Win=2047 Len=0 TSval=1271343778 TSecr=2646384476
  232 14.335060818 IP C → IP B TLSv1.2 905 Application Data, Application Data
  233 14.335286511 IP B → IP C TLSv1.2 101 Application Data
  234 14.336817336 IP C → IP B TCP 66 48018 → 443 [ACK] Seq=3937 Ack=35419 Win=46 Len=0 TSval=3709233674 TSecr=1632685216
  235 14.336825326 IP B → IP A TLSv1.2 1214 Application Data
  236 14.337220007 IP B → IP C TLSv1.2 3023 Application Data, Application Data
  237 14.338772084 IP C → IP B TCP 66 48018 → 443 [ACK] Seq=3937 Ack=38376 Win=46 Len=0 TSval=3709233676 TSecr=1632685218
  238 14.377894441 IP A → IP B TCP 66 6138 → 443 [ACK] Seq=7680 Ack=39971 Win=2030 Len=0 TSval=932516592 TSecr=2646384550
  239 14.546245540 IP C → IP B TLSv1.2 1594 Application Data, Application Data
  240 14.546302634 IP B → IP C TCP 66 443 → 48018 [ACK] Seq=38376 Ack=5465 Win=221 Len=0 TSval=1632685427 TSecr=3709233883
  241 14.546566401 IP B → IP C TLSv1.2 101 Application Data
  242 14.548062138 IP C → IP B TCP 66 48018 → 443 [ACK] Seq=5465 Ack=38411 Win=46 Len=0 TSval=3709233885 TSecr=1632685427
  243 14.548278424 IP B → IP C TCP 7306 [TCP segment of a reassembled PDU]
  244 14.548289013 IP B → IP C TLSv1.2 1042 Application Data
  245 14.548409493 IP B → IP C TLSv1.2 3207 Application Data, Application Data
  246 14.549808899 IP C → IP B TCP 66 48018 → 443 [ACK] Seq=5465 Ack=42755 Win=45 Len=0 TSval=3709233887 TSecr=1632685429
  247 14.549819748 IP C → IP B TCP 78 [TCP Dup ACK 246#1] 48018 → 443 [ACK] Seq=5465 Ack=42755 Win=45 Len=0 TSval=3709233887 TSecr=1632685429 SLE=45651 SRE=46627
  248 14.549848223 IP C → IP B TCP 66 48018 → 443 [ACK] Seq=5465 Ack=46627 Win=45 Len=0 TSval=3709233887 TSecr=1632685429
  249 14.549868270 IP C → IP B TCP 66 48018 → 443 [ACK] Seq=5465 Ack=49768 Win=45 Len=0 TSval=3709233887 TSecr=1632685429
  250 14.595332790 IP A → IP B TCP 78 6231 → 443 [SYN] Seq=0 Win=65535 Len=0 MSS=1440 WS=64 TSval=932516807 TSecr=0 SACK_PERM=1
  251 14.595372849 IP B → IP A TCP 74 443 → 6231 [SYN, ACK] Seq=0 Ack=1 Win=62643 Len=0 MSS=8961 SACK_PERM=1 TSval=2646384809 TSecr=932516807 WS=256
  252 14.661598581 IP A → IP B TCP 66 6231 → 443 [ACK] Seq=1 Ack=1 Win=131328 Len=0 TSval=932516873 TSecr=2646384809
  253 14.662363903 IP A → IP B TLSv1 609 Client Hello
  254 14.662384340 IP B → IP A TCP 66 443 → 6231 [ACK] Seq=1 Ack=544 Win=62208 Len=0 TSval=2646384876 TSecr=932516874
  255 14.663624221 IP B → IP A TLSv1.3 307 Server Hello, Change Cipher Spec, Application Data, Application Data
  256 14.730130127 IP A → IP B TCP 66 6231 → 443 [ACK] Seq=544 Ack=242 Win=131072 Len=0 TSval=932516939 TSecr=2646384877
  257 14.730146381 IP A → IP B TLSv1.3 146 Change Cipher Spec, Application Data
  258 14.730155633 IP B → IP A TCP 66 443 → 6231 [ACK] Seq=242 Ack=624 Win=62208 Len=0 TSval=2646384944 TSecr=932516941
  259 14.730356156 IP A → IP B TLSv1.3 116 Application Data
  260 14.730364564 IP B → IP A TCP 66 443 → 6231 [ACK] Seq=242 Ack=674 Win=62208 Len=0 TSval=2646384944 TSecr=932516941
  261 14.730488706 IP B → IP A TLSv1.3 305 Application Data
  262 14.730973422 IP B → IP A TLSv1.3 176 Application Data
  263 14.774510582 IP B → IP A SSH 110 Server: Encrypted packet (len=44)
  264 14.786827337 IP A → IP B TLSv1.2 141 Application Data
  265 14.786924532 IP A → IP B TCP 1494 [TCP segment of a reassembled PDU]
  266 14.786932279 IP B → IP A TCP 66 443 → 6138 [ACK] Seq=39971 Ack=9183 Win=221 Len=0 TSval=2646385000 TSecr=932516997
  267 14.787012899 IP B → IP A TLSv1.2 101 Application Data
  268 14.787210552 IP A → IP B TCP 1494 6138 → 443 [ACK] Seq=9183 Ack=39971 Win=2048 Len=1428 TSval=932516997 TSecr=2646384550 [TCP segment of a reassembled PDU]
  269 14.787228856 IP A → IP B TLSv1.2 93 Application Data
  270 14.787235514 IP B → IP A TCP 66 443 → 6138 [ACK] Seq=40006 Ack=10638 Win=221 Len=0 TSval=2646385001 TSecr=932516997
  271 14.787263088 IP A → IP B TCP 1494 [TCP segment of a reassembled PDU]
  272 14.787306609 IP A → IP B TCP 93 [TCP Previous segment not captured] 6138 → 443 [PSH, ACK] Seq=13494 Ack=39971 Win=2048 Len=27 TSval=932516997 TSecr=2646384550 [TCP segment of a reassembled PDU]
  273 14.787312060 IP B → IP A TCP 78 443 → 6138 [ACK] Seq=40006 Ack=12066 Win=221 Len=0 TSval=2646385001 TSecr=932516997 SLE=13494 SRE=13521
  274 14.787320052 IP A → IP B TCP 1494 [TCP Out-Of-Order] 6138 → 443 [ACK] Seq=12066 Ack=39971 Win=2048 Len=1428 TSval=932516997 TSecr=2646384550
  275 14.787325652 IP B → IP A TCP 66 443 → 6138 [ACK] Seq=40006 Ack=13521 Win=221 Len=0 TSval=2646385001 TSecr=932516997
  276 14.787336035 IP A → IP B TLSv1.2 93 [TCP Previous segment not captured] , Ignored Unknown Record
  277 14.787342832 IP B → IP A TCP 78 [TCP Dup ACK 275#1] 443 → 6138 [ACK] Seq=40006 Ack=13521 Win=221 Len=0 TSval=2646385001 TSecr=932516997 SLE=16377 SRE=16404
  278 14.787424743 IP A → IP B TCP 2922 [TCP Out-Of-Order] 6138 → 443 [ACK] Seq=13521 Ack=39971 Win=2048 Len=2856 TSval=932516997 TSecr=2646384550
  279 14.787434392 IP B → IP A TCP 66 443 → 6138 [ACK] Seq=40006 Ack=16404 Win=221 Len=0 TSval=2646385001 TSecr=932516997
  280 14.787580004 IP A → IP B TLSv1.2 93 [TCP Previous segment not captured] , Ignored Unknown Record
  281 14.787587532 IP B → IP A TCP 78 [TCP Dup ACK 279#1] 443 → 6138 [ACK] Seq=40006 Ack=16404 Win=221 Len=0 TSval=2646385001 TSecr=932516997 SLE=19260 SRE=19287
  282 14.787594366 IP A → IP B TCP 1494 [TCP Out-Of-Order] 6138 → 443 [ACK] Seq=16404 Ack=39971 Win=2048 Len=1428 TSval=932516997 TSecr=2646384550
  283 14.787601688 IP B → IP A TCP 78 443 → 6138 [ACK] Seq=40006 Ack=17832 Win=221 Len=0 TSval=2646385001 TSecr=932516997 SLE=19260 SRE=19287
  284 14.787616565 IP A → IP B TCP 1494 [TCP Out-Of-Order] 6138 → 443 [ACK] Seq=17832 Ack=39971 Win=2048 Len=1428 TSval=932516997 TSecr=2646384550
  285 14.787625017 IP B → IP A TCP 66 443 → 6138 [ACK] Seq=40006 Ack=19287 Win=221 Len=0 TSval=2646385001 TSecr=932516997
  286 14.787706130 IP A → IP B TLSv1.2 2350 Application Data
  287 14.787713161 IP B → IP A TCP 66 443 → 6138 [ACK] Seq=40006 Ack=21571 Win=221 Len=0 TSval=2646385001 TSecr=932516997
  288 14.793749236 IP A → IP B TCP 66 6231 → 443 [ACK] Seq=674 Ack=481 Win=130880 Len=0 TSval=932517004 TSecr=2646384944
  289 14.794811430 IP A → IP B TCP 66 6231 → 443 [ACK] Seq=674 Ack=591 Win=130944 Len=0 TSval=932517004 TSecr=2646384944
  290 14.796018735 IP A → IP B TLSv1.3 196 Application Data
  291 14.796030595 IP B → IP A TCP 66 443 → 6231 [ACK] Seq=591 Ack=804 Win=62208 Len=0 TSval=2646385010 TSecr=932517006
  292 14.796931578 IP B → IP A TLSv1.3 172 Application Data
  293 14.799308872 IP B → IP A TCP 2922 [TCP segment of a reassembled PDU]
  294 14.799319917 IP B → IP A TCP 2922 443 → 6138 [PSH, ACK] Seq=42862 Ack=21571 Win=221 Len=2856 TSval=2646385013 TSecr=932516997 [TCP segment of a reassembled PDU]
  295 14.799373760 IP B → IP A TLSv1.2 2570 Application Data
  296 14.799458748 IP B → IP A TCP 2922 [TCP segment of a reassembled PDU]
  297 14.799509469 IP B → IP A TLSv1.2 418 Application Data, Application Data
  298 14.809642836 IP C → IP B TLSv1.2 2962 Application Data
  299 14.809657244 IP B → IP C TCP 66 443 → 48018 [ACK] Seq=49768 Ack=8361 Win=221 Len=0 TSval=1632685690 TSecr=3709234147
  300 14.809671081 IP C → IP B TLSv1.2 1514 Application Data [TCP segment of a reassembled PDU]
  301 14.809693159 IP C → IP B TCP 1514 48018 → 443 [ACK] Seq=9809 Ack=49768 Win=46 Len=1448 TSval=3709234147 TSecr=1632685429 [TCP segment of a reassembled PDU]
  302 14.809703324 IP B → IP C TCP 66 443 → 48018 [ACK] Seq=49768 Ack=11257 Win=221 Len=0 TSval=1632685690 TSecr=3709234147
  303 14.809747833 IP C → IP B TLSv1.2 2997 Application Data, Application Data
  304 14.809753538 IP B → IP C TCP 66 443 → 48018 [ACK] Seq=49768 Ack=14188 Win=221 Len=0 TSval=1632685690 TSecr=3709234147
  305 14.809903064 IP B → IP C TLSv1.2 101 Application Data
  306 14.809942361 IP C → IP B TLSv1.2 578 Application Data
  307 14.811362979 IP C → IP B TCP 66 48018 → 443 [ACK] Seq=14700 Ack=49803 Win=46 Len=0 TSval=3709234149 TSecr=1632685690
  308 14.813073971 IP B → IP C TCP 7306 [TCP segment of a reassembled PDU]
  309 14.813085695 IP B → IP C TLSv1.2 1042 Application Data
  310 14.813218273 IP B → IP C TCP 5858 [TCP segment of a reassembled PDU]
  311 14.814647141 IP C → IP B TCP 66 48018 → 443 [ACK] Seq=14700 Ack=57043 Win=45 Len=0 TSval=3709234152 TSecr=1632685694
  312 14.814657296 IP B → IP C TLSv1.2 2099 Application Data, Application Data
  313 14.814666358 IP C → IP B TCP 66 48018 → 443 [ACK] Seq=14700 Ack=58019 Win=45 Len=0 TSval=3709234152 TSecr=1632685694
  314 14.814747795 IP C → IP B TCP 66 48018 → 443 [ACK] Seq=14700 Ack=59467 Win=46 Len=0 TSval=3709234152 TSecr=1632685694
  315 14.814771819 IP C → IP B TCP 66 48018 → 443 [ACK] Seq=14700 Ack=63811 Win=45 Len=0 TSval=3709234152 TSecr=1632685694
  316 14.816173070 IP C → IP B TCP 66 48018 → 443 [ACK] Seq=14700 Ack=65844 Win=45 Len=0 TSval=3709234153 TSecr=1632685695
  317 14.825442508 IP A → IP B TCP 66 6138 → 443 [ACK] Seq=21571 Ack=40006 Win=2047 Len=0 TSval=932517037 TSecr=2646385000
  318 14.838134739 IP A → IP B TCP 66 6138 → 443 [ACK] Seq=21571 Ack=42862 Win=2003 Len=0 TSval=932517049 TSecr=2646385013
  319 14.838144519 IP A → IP B TCP 66 6138 → 443 [ACK] Seq=21571 Ack=45718 Win=1958 Len=0 TSval=932517049 TSecr=2646385013
  320 14.838147287 IP A → IP B TCP 66 6138 → 443 [ACK] Seq=21571 Ack=48222 Win=1919 Len=0 TSval=932517049 TSecr=2646385013
  321 14.838402796 IP A → IP B TCP 66 6138 → 443 [ACK] Seq=21571 Ack=51078 Win=1875 Len=0 TSval=932517049 TSecr=2646385013
  322 14.838406291 IP A → IP B TCP 66 [TCP Window Update] 6138 → 443 [ACK] Seq=21571 Ack=51078 Win=2048 Len=0 TSval=932517049 TSecr=2646385013
  323 14.840160669 IP A → IP B TCP 66 6138 → 443 [ACK] Seq=21571 Ack=51430 Win=2042 Len=0 TSval=932517051 TSecr=2646385013
  324 14.846787925 IP A → IP B TCP 66 8864 → 22 [ACK] Seq=1 Ack=1277 Win=2047 Len=0 TSval=1271344282 TSecr=2646384988
  325 14.860533027 IP A → IP B TCP 66 6231 → 443 [ACK] Seq=804 Ack=697 Win=130944 Len=0 TSval=932517069 TSecr=2646385010
  326 14.982573898 IP A → IP B STUN 146 Binding Request user: 38n621el16dv6e:+Jh/
  327 14.985263869 IP A → IP B TCP 78 6234 → 443 [SYN] Seq=0 Win=65535 Len=0 MSS=1440 WS=64 TSval=932517189 TSecr=0 SACK_PERM=1
  328 14.985293712 IP B → IP A TCP 74 443 → 6234 [SYN, ACK] Seq=0 Ack=1 Win=62643 Len=0 MSS=8961 SACK_PERM=1 TSval=2646385199 TSecr=932517189 WS=256
  329 14.988188300 IP B → IP A STUN 146 Binding Success Response XOR-MAPPED-ADDRESS: IP A:6233 user: 38n621el16dv6e:+Jh/
  330 15.034026721 IP C → IP B TLSv1.2 2962 Application Data
  331 15.034056917 IP B → IP C TCP 66 443 → 48018 [ACK] Seq=65844 Ack=17596 Win=255 Len=0 TSval=1632685915 TSecr=3709234371
  332 15.034081949 IP C → IP B TLSv1.2 4410 Application Data, Application Data
  333 15.034090738 IP B → IP C TCP 66 443 → 48018 [ACK] Seq=65844 Ack=21940 Win=289 Len=0 TSval=1632685915 TSecr=3709234371
  334 15.034140248 IP C → IP B TCP 1514 48018 → 443 [ACK] Seq=21940 Ack=65844 Win=46 Len=1448 TSval=3709234371 TSecr=1632685695 [TCP segment of a reassembled PDU]
  335 15.034242901 IP C → IP B TLSv1.2 2985 Application Data, Application Data
  336 15.034242973 IP C → IP B TCP 1514 [TCP segment of a reassembled PDU]
  337 15.034251217 IP B → IP C TCP 66 443 → 48018 [ACK] Seq=65844 Ack=26307 Win=323 Len=0 TSval=1632685915 TSecr=3709234371
  338 15.034260508 IP C → IP B TLSv1.2 686 Application Data
  339 15.034263827 IP B → IP C TCP 66 443 → 48018 [ACK] Seq=65844 Ack=28375 Win=346 Len=0 TSval=1632685915 TSecr=3709234371
  340 15.034436526 IP B → IP C TLSv1.2 101 Application Data
  341 15.034449832 IP A → IP B DTLS 201 Client Hello
  342 15.035925047 IP C → IP B TCP 66 48018 → 443 [ACK] Seq=28375 Ack=65879 Win=46 Len=0 TSval=3709234373 TSecr=1632685915
  343 15.039357807 IP B → IP C TLSv1.2 4310 Application Data, Application Data
  344 15.040923835 IP C → IP B TCP 66 48018 → 443 [ACK] Seq=28375 Ack=67327 Win=46 Len=0 TSval=3709234378 TSecr=1632685920
  345 15.040931559 IP C → IP B TCP 66 48018 → 443 [ACK] Seq=28375 Ack=70123 Win=46 Len=0 TSval=3709234378 TSecr=1632685920
  346 15.052414754 IP C → IP B TCP 74 50984 → 443 [SYN] Seq=0 Win=29200 Len=0 MSS=1460 SACK_PERM=1 TSval=3709234390 TSecr=0 WS=4096
  347 15.052440150 IP B → IP C TCP 74 443 → 50984 [SYN, ACK] Seq=0 Ack=1 Win=62643 Len=0 MSS=8961 SACK_PERM=1 TSval=1632685933 TSecr=3709234390 WS=256
  348 15.053753740 IP A → IP B TCP 66 6234 → 443 [ACK] Seq=1 Ack=1 Win=131328 Len=0 TSval=932517258 TSecr=2646385199
  349 15.053908106 IP C → IP B TCP 66 50984 → 443 [ACK] Seq=1 Ack=1 Win=32768 Len=0 TSval=3709234391 TSecr=1632685933
  350 15.056033726 IP A → IP B TLSv1 609 Client Hello
  351 15.056044939 IP B → IP A TCP 66 443 → 6234 [ACK] Seq=1 Ack=544 Win=62208 Len=0 TSval=2646385270 TSecr=932517258
  352 15.056990057 IP B → IP A TLSv1.3 307 Server Hello, Change Cipher Spec, Application Data, Application Data
  353 15.079765740 IP C → IP B TCP 74 50986 → 443 [SYN] Seq=0 Win=29200 Len=0 MSS=1460 SACK_PERM=1 TSval=3709234417 TSecr=0 WS=4096
  354 15.079784668 IP B → IP C TCP 74 443 → 50986 [SYN, ACK] Seq=0 Ack=1 Win=62643 Len=0 MSS=8961 SACK_PERM=1 TSval=1632685960 TSecr=3709234417 WS=256
  355 15.081458864 IP A → IP B STUN 146 Binding Request user: 38n621el16dv6e:+Jh/
  356 15.081887004 IP B → IP A STUN 146 Binding Success Response XOR-MAPPED-ADDRESS: IP A:6233 user: 38n621el16dv6e:+Jh/
  357 15.082431321 IP C → IP B TCP 66 50986 → 443 [ACK] Seq=1 Ack=1 Win=32768 Len=0 TSval=3709234420 TSecr=1632685960
  358 15.096196421 IP C → IP B TLSv1 609 Client Hello
  359 15.096211131 IP B → IP C TCP 66 443 → 50984 [ACK] Seq=1 Ack=544 Win=62208 Len=0 TSval=1632685977 TSecr=3709234433
  360 15.097132824 IP B → IP C TLSv1.3 307 Server Hello, Change Cipher Spec, Application Data, Application Data
  361 15.098658601 IP C → IP B TCP 66 50984 → 443 [ACK] Seq=544 Ack=242 Win=32768 Len=0 TSval=3709234436 TSecr=1632685978
  362 15.125488611 IP A → IP B TCP 66 6234 → 443 [ACK] Seq=544 Ack=242 Win=131072 Len=0 TSval=932517326 TSecr=2646385270
  363 15.125498945 IP A → IP B TLSv1.3 146 Change Cipher Spec, Application Data
  364 15.125505456 IP B → IP A TCP 66 443 → 6234 [ACK] Seq=242 Ack=624 Win=62208 Len=0 TSval=2646385339 TSecr=932517328
  365 15.125724560 IP A → IP B TLSv1.3 116 Application Data
  366 15.125730995 IP B → IP A TCP 66 443 → 6234 [ACK] Seq=242 Ack=674 Win=62208 Len=0 TSval=2646385339 TSecr=932517328
  367 15.125746248 IP B → IP A TLSv1.3 305 Application Data
  368 15.126179859 IP B → IP A TLSv1.3 176 Application Data
  369 15.128888551 IP C → IP B TLSv1 609 Client Hello
  370 15.128901881 IP B → IP C TCP 66 443 → 50986 [ACK] Seq=1 Ack=544 Win=62208 Len=0 TSval=1632686009 TSecr=3709234466
  371 15.129629690 IP B → IP C TLSv1.3 307 Server Hello, Change Cipher Spec, Application Data, Application Data
  372 15.131046026 IP A → IP B STUN 146 Binding Request user: 38n621el16dv6e:+Jh/
  373 15.131509839 IP B → IP A STUN 146 Binding Success Response XOR-MAPPED-ADDRESS: IP A:6233 user: 38n621el16dv6e:+Jh/
  374 15.132283389 IP C → IP B TCP 66 50986 → 443 [ACK] Seq=544 Ack=242 Win=32768 Len=0 TSval=3709234469 TSecr=1632686010
  375 15.133089947 IP C → IP B TLSv1.2 278 Application Data, Application Data
  376 15.133277737 IP B → IP C TLSv1.2 101 Application Data
  377 15.134781172 IP C → IP B TCP 66 48018 → 443 [ACK] Seq=28587 Ack=70158 Win=46 Len=0 TSval=3709234472 TSecr=1632686014
  378 15.140148746 IP A → IP B DTLS 201 Client Hello
  379 15.153850296 IP C → IP B TLSv1.3 146 Change Cipher Spec, Application Data
  380 15.153870218 IP B → IP C TCP 66 443 → 50984 [ACK] Seq=242 Ack=624 Win=62208 Len=0 TSval=1632686034 TSecr=3709234491
  381 15.154062743 IP C → IP B TLSv1.3 116 Application Data
  382 15.154076690 IP B → IP C TCP 66 443 → 50984 [ACK] Seq=242 Ack=674 Win=62208 Len=0 TSval=1632686035 TSecr=3709234491
  383 15.154292993 IP B → IP C TLSv1.3 305 Application Data
  384 15.154651747 IP B → IP C TLSv1.3 176 Application Data
  385 15.155797268 IP C → IP B TCP 66 50984 → 443 [ACK] Seq=674 Ack=481 Win=32768 Len=0 TSval=3709234493 TSecr=1632686035
  386 15.156161582 IP C → IP B TCP 66 50984 → 443 [ACK] Seq=674 Ack=591 Win=32768 Len=0 TSval=3709234493 TSecr=1632686035
  387 15.170858434 IP A → IP B TLSv1.2 141 Application Data
  388 15.171012564 IP B → IP A TLSv1.2 101 Application Data
  389 15.171176972 IP A → IP B TCP 2922 [TCP segment of a reassembled PDU]
  390 15.171188601 IP B → IP A TCP 66 443 → 6138 [ACK] Seq=51465 Ack=24502 Win=221 Len=0 TSval=2646385385 TSecr=932517374
  391 15.171202843 IP A → IP B TLSv1.2 93 Application Data
  392 15.171219298 IP A → IP B TCP 1494 [TCP segment of a reassembled PDU]
  393 15.171226820 IP B → IP A TCP 66 443 → 6138 [ACK] Seq=51465 Ack=25957 Win=221 Len=0 TSval=2646385385 TSecr=932517374
  394 15.171286927 IP A → IP B TLSv1.2 1521 Application Data
  395 15.171291852 IP B → IP A TCP 66 443 → 6138 [ACK] Seq=51465 Ack=27412 Win=221 Len=0 TSval=2646385385 TSecr=932517374
  396 15.171506518 IP A → IP B TLSv1.2 93 [TCP Previous segment not captured] , Ignored Unknown Record
  397 15.171515952 IP B → IP A TCP 78 [TCP Dup ACK 395#1] 443 → 6138 [ACK] Seq=51465 Ack=27412 Win=221 Len=0 TSval=2646385385 TSecr=932517374 SLE=30268 SRE=30295
  398 15.171523426 IP A → IP B TCP 1494 [TCP Out-Of-Order] 6138 → 443 [ACK] Seq=27412 Ack=51430 Win=2048 Len=1428 TSval=932517374 TSecr=2646385013
  399 15.171530322 IP B → IP A TCP 78 443 → 6138 [ACK] Seq=51465 Ack=28840 Win=221 Len=0 TSval=2646385385 TSecr=932517374 SLE=30268 SRE=30295
  400 15.171536882 IP A → IP B TCP 1494 [TCP Out-Of-Order] 6138 → 443 [ACK] Seq=28840 Ack=51430 Win=2048 Len=1428 TSval=932517374 TSecr=2646385013
  401 15.171545614 IP B → IP A TCP 66 443 → 6138 [ACK] Seq=51465 Ack=30295 Win=221 Len=0 TSval=2646385385 TSecr=932517374
  402 15.171660923 IP A → IP B TLSv1.2 249 [TCP Previous segment not captured] , Application Data
  403 15.171668308 IP B → IP A TCP 78 [TCP Dup ACK 401#1] 443 → 6138 [ACK] Seq=51465 Ack=30295 Win=221 Len=0 TSval=2646385385 TSecr=932517374 SLE=33178 SRE=33361
